{
  "validationId": "VAL-L01-001",
  "validationIri": "tmf:validation/VAL-L01-001",
  "validationPerformedAt": "2026-08-08T14:40:11.633Z",
  "validationPeriod": {
    "start": "2026-08-06T22:00:00.003Z",
    "end": "2026-08-08T14:40:11.633Z"
  },
  "validationTargets": {
    "observations": [
      "tmf:observation/M-L01-MC-20250626T002555202Z",
      "tmf:observation/M-L01-RH-20250626T002555202Z",
      "tmf:observation/M-L01-T-20250626T002555202Z"
    ],
    "sensor": "tmf:sensor/MC-L01-01",
    "monitoringSeries": "tmf:monitoring-series/MS-L01-001",
    "installation": "tmf:installation/INST-L01-01"
  },
  "summary": {
    "overallDataQualityFlag": "Usable",
    "overallResult": "pass",
    "notes": "Validation separates observation-level checks, sensor-level checks, and whole-series checks. MC validation uses surrounding RH/T context and triangulation with the L-05 reference sensor."
  },
  "validationEntries": [
    {
      "validationEntryId": "VAL-L01-001-OBS-MC-001",
      "targetType": "Observation",
      "targetRecord": "tmf:observation/M-L01-MC-20250626T002555202Z",
      "targetProperty": "tmf:property/moisture-content",
      "observationTimestamp": "2025-06-26T00:25:55.202099Z",
      "validationPerformedAt": "2026-08-08T14:40:11.633Z",
      "validatedAgainst": [
        "unit:PERCENT for moisture-content observations",
        "project-defined plausible timber MC range",
        "surrounding RH and temperature observations from the same timestamp",
        "reference sensor MC trend from tmf:sensor/MC-L05-01 at L-05"
      ],
      "checks": [
        {
          "checkType": "unit-consistency",
          "status": "pass",
          "result": "Result is expressed as unit:PERCENT."
        },
        {
          "checkType": "plausible-value",
          "status": "pass",
          "result": "13.6 percent is plausible for the selected observation window."
        },
        {
          "checkType": "series-context",
          "status": "pass",
          "result": "Value is consistent with the early-series MC baseline."
        },
        {
          "checkType": "rh-temperature-context",
          "status": "pass",
          "result": "Surrounding RH and temperature values from the same timestamp are mutually plausible for the MC reading."
        },
        {
          "checkType": "reference-sensor-triangulation",
          "status": "pass",
          "result": "MC-L01-01 does not show an unexplained divergence from the L-05 reference sensor for this validation point."
        }
      ],
      "validatedValue": {
        "numericValue": 13.6,
        "unitRef": "unit:PERCENT",
        "simpleResult": "13.6 %"
      },
      "dataQualityFlag": "Usable"
    },
    {
      "validationEntryId": "VAL-L01-001-OBS-RH-001",
      "targetType": "Observation",
      "targetRecord": "tmf:observation/M-L01-RH-20250626T002555202Z",
      "targetProperty": "tmf:property/relative-humidity",
      "observationTimestamp": "2025-06-26T00:25:55.202099Z",
      "validationPerformedAt": "2026-08-08T14:40:11.633Z",
      "validatedAgainst": [
        "unit:PERCENT for relative-humidity observations",
        "physical RH range from 0 to 100 percent",
        "shared timestamp for the paired observation set"
      ],
      "checks": [
        {
          "checkType": "unit-consistency",
          "status": "pass",
          "result": "Result is expressed as unit:PERCENT."
        },
        {
          "checkType": "physical-range",
          "status": "pass",
          "result": "66.0 percent is within the physical RH range."
        },
        {
          "checkType": "timestamp-property-consistency",
          "status": "pass",
          "result": "Timestamp and observed-property links match the paired MC and temperature observations."
        }
      ],
      "validatedValue": {
        "numericValue": 66.0,
        "unitRef": "unit:PERCENT",
        "simpleResult": "66.0 %"
      },
      "dataQualityFlag": "Usable"
    },
    {
      "validationEntryId": "VAL-L01-001-OBS-T-001",
      "targetType": "Observation",
      "targetRecord": "tmf:observation/M-L01-T-20250626T002555202Z",
      "targetProperty": "tmf:property/air-temperature",
      "observationTimestamp": "2025-06-26T00:25:55.202099Z",
      "validationPerformedAt": "2026-08-08T14:40:11.633Z",
      "validatedAgainst": [
        "unit:DEG_C for air-temperature observations",
        "project-defined indoor temperature plausibility range",
        "shared timestamp for the paired observation set"
      ],
      "checks": [
        {
          "checkType": "unit-consistency",
          "status": "pass",
          "result": "Result is expressed as unit:DEG_C."
        },
        {
          "checkType": "plausible-value",
          "status": "pass",
          "result": "20.2 degC is plausible for the monitored indoor environment."
        },
        {
          "checkType": "timestamp-property-consistency",
          "status": "pass",
          "result": "Timestamp and observed-property links match the paired MC and RH observations."
        }
      ],
      "validatedValue": {
        "numericValue": 20.2,
        "unitRef": "unit:DEG_C",
        "simpleResult": "20.2 degC"
      },
      "dataQualityFlag": "Usable"
    },
    {
      "validationEntryId": "VAL-L01-001-SENSOR-001",
      "targetType": "Sensor",
      "targetRecord": "tmf:sensor/MC-L01-01",
      "relatedInstallation": "tmf:installation/INST-L01-01",
      "validationPerformedAt": "2026-08-08T14:40:11.633Z",
      "validatedAgainst": [
        "deployedSystem recorded in INST-L01-01",
        "manufacturer timber MC calibration basis",
        "active sensor status during the validation period",
        "normal sensor communication during the validation period"
      ],
      "checks": [
        {
          "checkType": "sensor-installation-match",
          "status": "pass",
          "result": "MC-L01-01 matches the deployed system in INST-L01-01."
        },
        {
          "checkType": "calibration-basis-present",
          "status": "pass",
          "result": "Manufacturer timber MC calibration basis is recorded."
        },
        {
          "checkType": "sensor-status",
          "status": "pass",
          "result": "Sensor status is Active."
        },
        {
          "checkType": "communication",
          "status": "pass",
          "result": "Normal transmission."
        }
      ],
      "sensorValidationStatus": "Validated"
    },
    {
      "validationEntryId": "VAL-L01-001-SERIES-001",
      "targetType": "MonitoringTimeSeries",
      "targetRecord": "tmf:monitoring-series/MS-L01-001",
      "relatedSensor": "tmf:sensor/MC-L01-01",
      "relatedInstallation": "tmf:installation/INST-L01-01",
      "relatedReferenceSensor": "tmf:sensor/MC-L05-01",
      "relatedReferenceLocation": "tmf:location/L-05",
      "seriesPeriod": {
        "start": "2025-06-26T00:25:55.202099Z",
        "end": "2025-06-27T23:46:50.857321Z"
      },
      "validationPerformedAt": "2026-08-08T14:40:11.633Z",
      "validatedAgainst": [
        "ordered timestamps within MS-L01-001",
        "declared PT1H sampling interval with sensor-clock tolerance",
        "absence of unexplained data gaps",
        "whole-series drift review across MC, RH, and temperature",
        "surrounding RH and temperature context for MC interpretation",
        "reference sensor triangulation with MC-L05-01 at L-05"
      ],
      "checks": [
        {
          "checkType": "time-order",
          "status": "pass",
          "result": "Timestamps are ordered."
        },
        {
          "checkType": "sampling-interval",
          "status": "pass",
          "result": "Hourly observation pattern retained within expected sensor-clock tolerance."
        },
        {
          "checkType": "missing-data",
          "status": "pass",
          "result": "No gap detected in the selected two-day window."
        },
        {
          "checkType": "whole-series-drift",
          "status": "pass",
          "result": "No drift suspected from the selected two-day series review."
        },
        {
          "checkType": "cross-channel-consistency",
          "status": "pass",
          "result": "MC, surrounding RH, and surrounding temperature values remain mutually plausible across the reviewed window."
        },
        {
          "checkType": "reference-sensor-triangulation",
          "status": "pass",
          "result": "The L-01 series is interpreted against the L-05 reference sensor to distinguish local moisture behaviour from broader background variation."
        }
      ],
      "dataQualityFlag": "Usable"
    }
  ]
}
